{
  "$schema": "https://json-schema.org/draft/2020-12/schema",
  "$id": "https://example.invalid/dacn/d0/tool_call.schema.json",
  "title": "tool_call d0-v1",
  "type": "object",
  "additionalProperties": false,
  "required": [
    "schema_version",
    "call_id",
    "case_id",
    "expected_revision",
    "tool_id",
    "tool_version",
    "provider_id",
    "target_ref",
    "arguments",
    "reason",
    "requested_by",
    "requested_at",
    "budget"
  ],
  "properties": {
    "schema_version": {
      "type": "string",
      "minLength": 1,
      "pattern": "^d0-v1$"
    },
    "call_id": {
      "type": "string",
      "minLength": 1,
      "pattern": "^CALL-[A-Za-z0-9_-]{8,100}$"
    },
    "case_id": {
      "type": "string",
      "minLength": 1,
      "pattern": "^CASE-[A-Za-z0-9_-]+$"
    },
    "expected_revision": {
      "type": "integer",
      "minimum": 1
    },
    "tool_id": {
      "type": "string",
      "minLength": 1,
      "pattern": "^[a-z][a-z0-9_.-]{1,80}$"
    },
    "tool_version": {
      "type": "string",
      "minLength": 1
    },
    "provider_id": {
      "type": "string",
      "minLength": 1,
      "pattern": "^[a-z][a-z0-9_.-]{1,80}$"
    },
    "target_ref": {
      "$ref": "target_ref.schema.json"
    },
    "arguments": {
      "type": "object"
    },
    "reason": {
      "type": "string",
      "minLength": 1
    },
    "requested_by": {
      "type": "string",
      "minLength": 1,
      "enum": [
        "workflow",
        "agent",
        "analyst"
      ]
    },
    "requested_at": {
      "type": "string",
      "minLength": 1,
      "pattern": "^\\d{4}-\\d{2}-\\d{2}T\\d{2}:\\d{2}:\\d{2}(?:\\.\\d+)?(?:Z|[+-]\\d{2}:\\d{2})$"
    },
    "budget": {
      "type": "object",
      "additionalProperties": false,
      "required": [
        "timeout_ms",
        "max_output_bytes"
      ],
      "properties": {
        "timeout_ms": {
          "type": "integer",
          "minimum": 1
        },
        "max_output_bytes": {
          "type": "integer",
          "minimum": 1
        }
      }
    }
  }
}
