{
  "schema_version": "d0-v1",
  "call_id": "CALL-fixture0001",
  "case_id": "CASE-fixture0001",
  "expected_revision": 1,
  "tool_id": "static.ember_features",
  "tool_version": "0.1.0",
  "provider_id": "ember_local",
  "target_ref": {
    "schema_version": "target-ref-v1",
    "kind": "FILE",
    "observed": {
      "path": "C:\\samples\\fixture.exe"
    },
    "identity_strength": "PARTIAL",
    "verified_digest": {
      "algorithm": "sha256",
      "value": "aaaaaaaaaaaaaaaaaaaaaaaaaaaaaaaaaaaaaaaaaaaaaaaaaaaaaaaaaaaaaaaa"
    },
    "snapshot": {
      "size_bytes": 1024,
      "mtime_ns": 123456789
    },
    "revalidation_required": true
  },
  "arguments": {
    "feature_version": 2
  },
  "reason": "Unknown reputation; static analysis required",
  "requested_by": "workflow",
  "requested_at": "2026-10-23T10:00:00Z",
  "budget": {
    "timeout_ms": 10000,
    "max_output_bytes": 4096
  }
}
